{
  "authority": {
    "kind": "production_canon",
    "level": "P1"
  },
  "constraints": [],
  "evidence": [],
  "facts": {},
  "id": "system.work_sessions",
  "relationships": [
    {
      "predicate": "produces",
      "target": "system.evidence"
    },
    {
      "predicate": "related_to",
      "target": "system.hindsight"
    }
  ],
  "schema_version": "0.1",
  "sources": [
    {
      "kind": "source_file",
      "path": "App/WorkSessionEngine.swift"
    },
    {
      "kind": "source_file",
      "path": "App/GameStore.swift"
    }
  ],
  "status": "canonical",
  "summary": "WorkSessionEngine supplies shared Work Session rules and records for Aurora, Stacks, and Brio.",
  "superseded_by": [],
  "supersedes": [],
  "tags": [
    "system"
  ],
  "title": "Work Sessions",
  "type": "system",
  "validity": {
    "valid_from": "2026-10-03",
    "valid_until": null
  },
  "visibility": [
    "developer"
  ]
}
