{
  "authority": {
    "kind": "production_canon",
    "level": "P1"
  },
  "constraints": [],
  "evidence": [],
  "facts": {},
  "id": "rule.determinism",
  "relationships": [],
  "schema_version": "0.1",
  "sources": [
    {
      "kind": "documentation",
      "path": "AGENTS.md"
    },
    {
      "kind": "source_file",
      "path": "App/SimulationEngine.swift"
    },
    {
      "kind": "source_file",
      "path": "App/GameStore.swift"
    }
  ],
  "status": "canonical",
  "summary": "Preserve seeded RNG order, cached outcomes, and stable replay behavior; production code defines exact formulas.",
  "superseded_by": [],
  "supersedes": [],
  "tags": [
    "rule"
  ],
  "title": "Determinism rule",
  "type": "rule",
  "validity": {
    "valid_from": "2026-10-03",
    "valid_until": null
  },
  "visibility": [
    "developer",
    "simulation_internal"
  ]
}
