{
  "authority": {
    "kind": "production_canon",
    "level": "P1"
  },
  "constraints": [],
  "evidence": [],
  "facts": {},
  "id": "rule.presentation_separation",
  "relationships": [
    {
      "predicate": "depends_on",
      "target": "rule.simulation_authority"
    }
  ],
  "schema_version": "0.1",
  "sources": [
    {
      "kind": "documentation",
      "path": "AGENTS.md"
    },
    {
      "kind": "source_file",
      "path": "App/LivingCompanyPresentation.swift"
    },
    {
      "kind": "source_file",
      "path": "App/PresentationCoordinator.swift"
    }
  ],
  "status": "canonical",
  "summary": "Presentation selection, camera, choreography, and emphasis are projections, not gameplay authorities.",
  "superseded_by": [],
  "supersedes": [],
  "tags": [
    "rule"
  ],
  "title": "Presentation separation rule",
  "type": "rule",
  "validity": {
    "valid_from": "2026-10-03",
    "valid_until": null
  },
  "visibility": [
    "developer"
  ]
}
