{
  "authority": {
    "kind": "production_canon",
    "level": "P1"
  },
  "constraints": [],
  "evidence": [],
  "facts": {
    "ledger": "CompanyFinance",
    "state_field": "FounderStats.revenue"
  },
  "id": "mechanic.revenue",
  "relationships": [
    {
      "predicate": "implemented_by",
      "target": "system.simulation"
    }
  ],
  "schema_version": "0.1",
  "sources": [
    {
      "kind": "source_file",
      "path": "App/GameModels.swift"
    },
    {
      "kind": "source_file",
      "path": "App/CompanyFinance.swift"
    },
    {
      "kind": "source_file",
      "path": "App/GameStore.swift"
    }
  ],
  "status": "canonical",
  "summary": "FounderStats tracks Revenue while CompanyFinance is the canonical financial ledger.",
  "superseded_by": [],
  "supersedes": [],
  "tags": [
    "mechanic"
  ],
  "title": "Revenue",
  "type": "mechanic",
  "validity": {
    "valid_from": "2026-10-03",
    "valid_until": null
  },
  "visibility": [
    "developer",
    "founder_known"
  ]
}
