{
  "authority": {
    "kind": "accepted",
    "level": "P2"
  },
  "constraints": [],
  "evidence": [],
  "facts": {
    "authority": "reviewed project knowledge",
    "not": [
      "GameStore",
      "runtime mutable state",
      "Loop V3 evidence",
      "chat memory",
      "generated embeddings"
    ]
  },
  "id": "system.canon",
  "relationships": [
    {
      "predicate": "related_to",
      "target": "system.evidence"
    },
    {
      "predicate": "related_to",
      "target": "system.loop"
    },
    {
      "predicate": "governed_by",
      "target": "rule.canon_promotion"
    },
    {
      "predicate": "governed_by",
      "target": "rule.canon_visibility"
    }
  ],
  "schema_version": "0.1",
  "sources": [
    {
      "kind": "documentation",
      "path": "Canon/README.md"
    },
    {
      "kind": "documentation",
      "path": "AGENTS.md"
    }
  ],
  "status": "accepted",
  "summary": "SOLO Canon is reviewed project knowledge authority, separate from mutable simulation, Loop evidence, chat memory, and embeddings.",
  "superseded_by": [],
  "supersedes": [],
  "tags": [
    "system"
  ],
  "title": "SOLO Canon",
  "type": "system",
  "validity": {
    "valid_from": "2026-10-03",
    "valid_until": null
  },
  "visibility": [
    "developer"
  ]
}
