{
  "authority": {
    "kind": "production_canon",
    "level": "P1"
  },
  "constraints": [],
  "evidence": [],
  "facts": {
    "save_version": 20
  },
  "id": "system.persistence",
  "relationships": [
    {
      "predicate": "depends_on",
      "target": "system.simulation"
    },
    {
      "predicate": "governed_by",
      "target": "rule.save_compatibility"
    }
  ],
  "schema_version": "0.1",
  "sources": [
    {
      "kind": "source_file",
      "path": "App/GameStore.swift"
    },
    {
      "kind": "source_file",
      "path": "App/GameModels.swift"
    }
  ],
  "status": "canonical",
  "summary": "GameStore writes and restores the career save; the current save envelope version is 20.",
  "superseded_by": [],
  "supersedes": [],
  "tags": [
    "system"
  ],
  "title": "Career persistence",
  "type": "system",
  "validity": {
    "valid_from": "2026-10-03",
    "valid_until": null
  },
  "visibility": [
    "developer",
    "simulation_internal"
  ]
}
