{
  "authority": {
    "kind": "production_canon",
    "level": "P1"
  },
  "constraints": [],
  "evidence": [],
  "facts": {},
  "id": "rule.save_compatibility",
  "relationships": [
    {
      "predicate": "depends_on",
      "target": "system.persistence"
    }
  ],
  "schema_version": "0.1",
  "sources": [
    {
      "kind": "documentation",
      "path": "AGENTS.md"
    },
    {
      "kind": "source_file",
      "path": "App/GameStore.swift"
    }
  ],
  "status": "canonical",
  "summary": "Preserve the GameStore career save and migration chain; Canon does not write save state.",
  "superseded_by": [],
  "supersedes": [],
  "tags": [
    "rule"
  ],
  "title": "Save compatibility rule",
  "type": "rule",
  "validity": {
    "valid_from": "2026-10-03",
    "valid_until": null
  },
  "visibility": [
    "developer"
  ]
}
