{
  "authority": {
    "kind": "production_canon",
    "level": "P1"
  },
  "constraints": [],
  "evidence": [],
  "facts": {},
  "id": "rule.hidden_truth",
  "relationships": [
    {
      "predicate": "governed_by",
      "target": "rule.canon_visibility"
    }
  ],
  "schema_version": "0.1",
  "sources": [
    {
      "kind": "documentation",
      "path": "AGENTS.md"
    },
    {
      "kind": "source_file",
      "path": "App/LivingCompanyPresentation.swift"
    },
    {
      "kind": "source_file",
      "path": "App/SignalTVModels.swift"
    }
  ],
  "status": "canonical",
  "summary": "Unrevealed quality, verification, drift, overclaim, and related hidden results must not reach Founder-facing or public presentation before canonical reveal.",
  "superseded_by": [],
  "supersedes": [],
  "tags": [
    "rule"
  ],
  "title": "Hidden truth rule",
  "type": "rule",
  "validity": {
    "valid_from": "2026-10-03",
    "valid_until": null
  },
  "visibility": [
    "developer",
    "simulation_internal"
  ]
}
